<?xml version='1.0' encoding='utf-8'?>
<GuidanceClaimDocument xmlns="urn:MHLW:guidance:claim:GC:2021" xmlns:xsi="http://www.w3.org/2001/XMLSchema-instance" xmlns:dt="urn:MHLW:share:datatype:2021" xsi:schemaLocation="urn:MHLW:guidance:claim:GC:2021 gc08_V08.xsd urn:MHLW:share:datatype:2021 datatypes_hcgv08.xsd">
  <documentId root="1.2.392.200119.6.1.GC.DEFAULT"/>
  <creationTime value="20250605030536+0000"/>
  <authorInstitution>
    <dt:id root="1.2.392.200119.6.102.1" extension="GUIDE_CTR_002"/>
  </authorInstitution>
  <patient>
    <id root="1.2.392.200119.6.201" extension="P004"/>
  </patient>
  <healthInsurance>
    <insurer>
      <dt:id root="1.2.392.200119.6.101" extension="INS004"/>
    </insurer>
  </healthInsurance>
  <encounter>
    <guidanceOrg>
      <dt:id root="1.2.392.200119.6.102.1" extension="GUIDE_CTR_002"/>
    </guidanceOrg>
    <guidanceLevel code="2" codeSystem="1.2.392.200119.6.1113"/>
    <timing code="3" codeSystem="1.2.392.200119.6.1114"/>
  </encounter>
  <healthGuidanceCard>
    <copaymentType code="2" codeSystem="1.2.392.200119.6.1109"/>
    <pointsCompleted value="80"/>
    <pointsIntended value="80"/>
  </healthGuidanceCard>
  <settlementDetails>
    <totalCost value="8000" currency="JPY"/>
    <copaymentAmount value="0" currency="JPY"/>
    <claimAmount value="8000" currency="JPY"/>
  </settlementDetails>
</GuidanceClaimDocument>
